<?xml version="1.0" encoding="utf-8"?>

<machine Name="DropTest" Subject="test" NumConditions="1" MaximumTrials="100" ITILength="1000" xmlns="http://www.timbuschman.com/behavioralstatemachine" xmlns:xsi="http://www.w3.org/2001/XMLSchema-instance" xsi:schemaLocation="http://www.timbuschman.com/behavioralstatemachine file:///C:/BehavioralControl/BSM%20XML/BSM.xsd" xsi:noNamespaceSchemaLocation="BSM.xsd">

  <State Name="Idle" ID="1" Interruptable="true">
    <Transition To="Reward">
      <Logic>sum(abs(AnalogTouch)) &gt;= TouchThresh</Logic>
    </Transition>
    <Transition To="NoResponseEndState">
      <Logic>TimeInState &gt;= 3000</Logic>
    </Transition>
  </State>
  <State Name="Reward" ID="2" Interruptable="false">
    <Transition To="CorrectEndState">
      <Logic>TimeInState &gt;= IdleTime</Logic>
    </Transition>
    <DigitalOutput VarName="DigitalOut" Function="[ones(100, 1); zeros(20, 1)]"/>
  </State>
  <DigitalInput SourceType="nidaq" SourceName="Dev1" Name="Touch" DefaultValue="0" SaveSamples="true">
    <Channel>1</Channel>
    <Channel>0</Channel>
  </DigitalInput>
  <AnalogInput Name="AnalogTouch" SourceType="ni" SourceName="Dev1" SourceRate="2000" KeepSamples="10" SaveSamples="true">
    <Channel>0</Channel>
  </AnalogInput>
  <ConditionVar Name="IdleTime" Function="500"/>
  <ConditionVar Name="Dropsize" Function="100"/>
  <ConditionVar Name="TouchThresh" Function=".1"/>
  <AnalogOutput SourceType="ni" SourceName="Dev1" SourceRate="1000" Name="Stimulator">
    <Channel>1</Channel>
  </AnalogOutput>
  <DigitalOutput SourceName="Dev1" SourceType="nidaq" Name="DigitalOut" DefaultValue="0">
    <Channel>16</Channel>
  </DigitalOutput>
  <ChooseNextCondition>1</ChooseNextCondition>
</machine>





