<?xml version="1.0" encoding="utf-8"?>

<machine Name="Test" Subject="testy" NumConditions="2" MaximumTrials="5" ITILength="1000" xmlns="http://www.timbuschman.com/behavioralstatemachine" xmlns:xsi="http://www.w3.org/2001/XMLSchema-instance" xsi:schemaLocation="http://www.timbuschman.com/behavioralstatemachine file:///C:/BehavioralControl/BSM%20XML/BSM.xsd" xsi:noNamespaceSchemaLocation="BSM.xsd">

  <State Name="Idle" ID="1" Interruptable="true">
    <Transition To="Stim">
      <Logic>TimeInState &gt;= IdleTime</Logic>
    </Transition>
  </State>
  <State Name="Stim" ID="2" Interruptable="false">
    <Transition To="Reward">
      <Logic>TimeInState &gt;= StimTime</Logic>
    </Transition>
    <AnalogOutput VarName="Stimulator" Function="SinStim"/>
    <DigitalOutput VarName="DigitalOut" Function="1"/>
  </State>
  <State Name="Reward" ID="3" Interruptable="false">
    <Transition To="EndState">
      <Logic>TimeInState &gt;= IdleTime</Logic>
    </Transition>
    <DigitalOutput VarName="DigitalOut" Function="0"/>
  </State>
  <AnalogInput SourceType="ni" SourceName="Dev1" SourceRate="2000" KeepSamples="10" SaveSamples="true" Name="AnalogTouch">
    <Channel>8</Channel>
    <Channel>1</Channel>
    <Channel>0</Channel>
  </AnalogInput>
  <ConditionVar Name="IdleTime" Function="500"/>
  <ConditionVar Name="StimTime" Function="IdleTime+5*CurrentTrial"/>
  <ConditionVar Name="SinStim" Function="sin([0:1000]'/1000*2*pi*10*CurrentCondition)"/>
  <AnalogOutput SourceType="ni" SourceName="Dev1" SourceRate="1000" Name="Stimulator">
    <Channel>1</Channel>
  </AnalogOutput>
  <DigitalOutput SourceName="Dev1" SourceType="nidaq" Name="DigitalOut" DefaultValue="0">
    <Channel>16</Channel>
  </DigitalOutput>
  <ChooseNextCondition>mod(CurrentTrial-1, 2)+1</ChooseNextCondition>
</machine>





